{
  "metadata": {
    "schema_version": "1.2.0",
    "process": "storm-cloud-product-development",
    "repository": "",
    "feature_root": "features",
    "created_at": "",
    "updated_at": "",
    "generated_by": "agent",
    "notes": []
  },
  "vision": {
    "id": "VS-0001",
    "statement": "",
    "status": "needs_review",
    "provenance": "not_defined",
    "confidence": 0.0,
    "evidence": [],
    "open_questions": []
  },
  "product_goal": {
    "id": "PG-0001",
    "statement": "",
    "status": "needs_review",
    "provenance": "not_defined",
    "confidence": 0.0,
    "supported_by_needs": [],
    "success_measures": [],
    "non_goals": [],
    "evidence": [],
    "open_questions": []
  },
  "needs": [],
  "constraints": [],
  "stories": [],
  "tests": [],
  "gherkin_features": [],
  "gherkin_rules": [],
  "gherkin_scenarios": [],
  "step_definitions": [],
  "code_units": [],
  "conflicts": [],
  "dependencies": [],
  "ranking": [],
  "process_audit": {
    "last_run_at": "",
    "metrics": {},
    "scorecard": {},
    "improvements": [],
    "metrics_version": 2
  },
  "enablers": []
}
